{
  "schemaVersion": "2.0",
  "id": "io.github.vst93.v",
  "name": "V Tools",
  "description": "Developer tools running in the terminal",
  "homepage": "https://github.com/vst93/v",
  "publisher": {
    "id": "vst93",
    "name": "vst"
  },
  "compatibility": {
    "floter": ">=0.3.0",
    "providerProtocol": "^1.0"
  },
  "distribution": {
    "type": "local"
  },
  "runtime": {
    "type": "system",
    "executableNames": ["v"],
    "versionArgs": ["--version"]
  },
  "provider": {
    "type": "executable",
    "argsPrefix": ["--floter"],
    "describeTimeoutMs": 5000,
    "completeTimeoutMs": 800
  },
  "permissions": [
    "filesystem-read",
    "filesystem-write",
    "network-fetch",
    "process-spawn",
    "clipboard-read",
    "clipboard-write",
    "environment"
  ]
}
